{
  "$schema": "../theme-schema.json",
  "name": "random-access-theme",
  "vars": {
    "bg": "#000000",
    "bg1": "#090a0b",
    "bg2": "#101214",
    "surface": "#0b0c0e",
    "overlay": "#1a1c20",
    "text": "#d8efe9",
    "subtle": "#9cb7af",
    "dimText": "#6f8d86",
    "cyan": "#00ffb2",
    "mint": "#00ffb2",
    "green": "#4ade80",
    "teal": "#35d5c5",
    "jade": "#66e3c4",
    "aqua": "#8bf5dd",
    "emerald": "#26c994",
    "lime": "#a2e5b8",
    "paToolPendingBg": "#1c2120",
    "paToolSuccessBg": "#132016",
    "paToolErrorBg": "#251918",
    "paUserMessageBg": "#08110f",
    "paCustomMessageBg": "#070e0c",
    "paToolPanelBg": "#0e1d19",
    "paSelectedBg": "#19312a",
    "paDiffAddedBg": "#192e1e",
    "paDiffRemovedBg": "#2d1b1a",
    "paDiffText": "#d8efe9"
  },
  "colors": {
    "accent": "mint",
    "border": "subtle",
    "borderAccent": "mint",
    "borderMuted": "subtle",
    "success": "green",
    "error": "emerald",
    "warning": "lime",
    "muted": "subtle",
    "dim": "dimText",
    "text": "text",
    "thinkingText": "jade",
    "selectedBg": "paSelectedBg",
    "userMessageBg": "paUserMessageBg",
    "userMessageText": "text",
    "customMessageBg": "paCustomMessageBg",
    "customMessageText": "text",
    "customMessageLabel": "mint",
    "toolPendingBg": "paToolPendingBg",
    "toolSuccessBg": "paToolSuccessBg",
    "toolErrorBg": "paToolErrorBg",
    "toolDiffAddedBg": "paDiffAddedBg",
    "toolDiffRemovedBg": "paDiffRemovedBg",
    "toolPanelBg": "paToolPanelBg",
    "toolTitle": "mint",
    "toolOutput": "text",
    "mdHeading": "mint",
    "mdLink": "cyan",
    "mdLinkUrl": "subtle",
    "mdCode": "cyan",
    "mdCodeBlock": "text",
    "mdCodeBlockBorder": "subtle",
    "mdQuote": "subtle",
    "mdQuoteBorder": "teal",
    "mdHr": "subtle",
    "mdListBullet": "mint",
    "toolDiffAdded": "green",
    "toolDiffRemoved": "emerald",
    "toolDiffText": "paDiffText",
    "toolDiffContext": "subtle",
    "syntaxComment": "dimText",
    "syntaxKeyword": "jade",
    "syntaxFunction": "green",
    "syntaxVariable": "text",
    "syntaxString": "lime",
    "syntaxNumber": "aqua",
    "syntaxType": "cyan",
    "syntaxOperator": "emerald",
    "syntaxPunctuation": "subtle",
    "thinkingOff": "#6f8d84",
    "thinkingMinimal": "#59a48d",
    "thinkingLow": "#43ba96",
    "thinkingMedium": "#2dd19f",
    "thinkingHigh": "#16e8a9",
    "thinkingXhigh": "#00ffb2",
    "bashMode": "lime"
  },
  "export": {
    "pageBg": "#000000",
    "cardBg": "#0b0c0e",
    "infoBg": "#101214"
  }
}
