{
  "$schema": "../theme-schema.json",
  "name": "reckoner-scope-sol",
  "vars": {
    "bg0": "#f0f2f0",
    "bg1": "#f5f7f6",
    "bg2": "#e7ebe9",
    "bg3": "#dee3df",
    "line": "#c2d1c6",
    "muted0": "#428056",
    "muted1": "#3e754e",
    "text0": "#115525",
    "text1": "#297542",
    "greenHot": "#067929",
    "greenPeak": "#06792a",
    "amber": "#786811",
    "alarm": "#c72d0a",
    "paToolPendingBg": "#ecefec",
    "paToolSuccessBg": "#e6efe9",
    "paToolErrorBg": "#ebe3e0",
    "paUserMessageBg": "#eaf0ec",
    "paCustomMessageBg": "#eaf0eb",
    "paToolPanelBg": "#ebf0ec",
    "paSelectedBg": "#dae2dc",
    "paDiffAddedBg": "#e0ebe3",
    "paDiffRemovedBg": "#ebe3e0",
    "paDiffText": "#5b4848",
    "paDim": "#688d72",
    "paBashMode": "#f1f0e9"
  },
  "colors": {
    "accent": "greenHot",
    "border": "bg2",
    "borderAccent": "line",
    "borderMuted": "bg3",
    "success": "text0",
    "error": "alarm",
    "warning": "amber",
    "muted": "muted1",
    "dim": "paDim",
    "text": "text0",
    "thinkingText": "muted1",
    "selectedBg": "paSelectedBg",
    "userMessageBg": "paUserMessageBg",
    "userMessageText": "text0",
    "customMessageBg": "paCustomMessageBg",
    "customMessageText": "text0",
    "customMessageLabel": "greenHot",
    "toolPendingBg": "paToolPendingBg",
    "toolSuccessBg": "paToolSuccessBg",
    "toolErrorBg": "paToolErrorBg",
    "toolDiffAddedBg": "#3a734a",
    "toolDiffRemovedBg": "#9b5740",
    "toolPanelBg": "paToolPanelBg",
    "toolTitle": "greenHot",
    "toolOutput": "text1",
    "mdHeading": "greenPeak",
    "mdLink": "greenHot",
    "mdLinkUrl": "muted1",
    "mdCode": "greenPeak",
    "mdCodeBlock": "text1",
    "mdCodeBlockBorder": "#447454",
    "mdQuote": "muted1",
    "mdQuoteBorder": "#447454",
    "mdHr": "#447454",
    "mdListBullet": "greenHot",
    "toolDiffAdded": "greenHot",
    "toolDiffRemoved": "alarm",
    "toolDiffText": "paDiffText",
    "toolDiffContext": "muted1",
    "syntaxComment": "muted0",
    "syntaxKeyword": "greenHot",
    "syntaxFunction": "greenPeak",
    "syntaxVariable": "text0",
    "syntaxString": "#177735",
    "syntaxNumber": "#10792d",
    "syntaxType": "greenHot",
    "syntaxOperator": "muted1",
    "syntaxPunctuation": "muted1",
    "thinkingOff": "#70a47f",
    "thinkingMinimal": "#57a26e",
    "thinkingLow": "#469b5f",
    "thinkingMedium": "#349350",
    "thinkingHigh": "#238b42",
    "thinkingXhigh": "#157f35",
    "bashMode": "paBashMode"
  },
  "export": {
    "pageBg": "#f0f2f0",
    "cardBg": "#f5f7f6",
    "infoBg": "#e7ebe9"
  }
}
