{
  "$schema": "../theme-schema.json",
  "name": "reckoner-factory-sol",
  "vars": {
    "bg0": "#f6f6f6",
    "bg1": "#f1f1f1",
    "bg2": "#eae9e9",
    "bg3": "#e1e0e0",
    "line": "#cac9c9",
    "muted0": "#7b7460",
    "muted1": "#78665e",
    "text0": "#5b4848",
    "text1": "#78655e",
    "accent": "#b4460e",
    "accent2": "#b5460d",
    "accent3": "#b14810",
    "success0": "#44744b",
    "warning0": "#896020",
    "error0": "#ce1c25",
    "info0": "#135af1",
    "paToolPendingBg": "#f1ece9",
    "paToolSuccessBg": "#e6efe6",
    "paToolErrorBg": "#ebe0e1",
    "paUserMessageBg": "#f1ece9",
    "paCustomMessageBg": "#f1ece9",
    "paToolPanelBg": "#f1ece9",
    "paSelectedBg": "#e5dbd7",
    "paDiffAddedBg": "#e0ebe2",
    "paDiffRemovedBg": "#ebe0e1",
    "paDiffText": "#5b4848",
    "paDim": "#918273",
    "paSyntaxComment": "#eeeded"
  },
  "colors": {
    "accent": "accent",
    "border": "bg3",
    "borderAccent": "accent3",
    "borderMuted": "line",
    "success": "success0",
    "error": "error0",
    "warning": "warning0",
    "muted": "muted1",
    "dim": "paDim",
    "text": "text0",
    "thinkingText": "muted1",
    "selectedBg": "paSelectedBg",
    "userMessageBg": "paUserMessageBg",
    "userMessageText": "text0",
    "customMessageBg": "paCustomMessageBg",
    "customMessageText": "text0",
    "customMessageLabel": "accent",
    "toolPendingBg": "paToolPendingBg",
    "toolSuccessBg": "paToolSuccessBg",
    "toolErrorBg": "paToolErrorBg",
    "toolDiffAddedBg": "#4b7250",
    "toolDiffRemovedBg": "#be363f",
    "toolPanelBg": "paToolPanelBg",
    "toolTitle": "accent",
    "toolOutput": "text1",
    "mdHeading": "accent",
    "mdLink": "accent",
    "mdLinkUrl": "muted1",
    "mdCode": "accent2",
    "mdCodeBlock": "text1",
    "mdCodeBlockBorder": "#78655e",
    "mdQuote": "muted1",
    "mdQuoteBorder": "#78655e",
    "mdHr": "#78655e",
    "mdListBullet": "accent",
    "toolDiffAdded": "success0",
    "toolDiffRemoved": "error0",
    "toolDiffText": "paDiffText",
    "toolDiffContext": "muted1",
    "syntaxComment": "#817365",
    "syntaxKeyword": "accent3",
    "syntaxFunction": "accent",
    "syntaxVariable": "text1",
    "syntaxString": "success0",
    "syntaxNumber": "warning0",
    "syntaxType": "info0",
    "syntaxOperator": "accent2",
    "syntaxPunctuation": "muted1",
    "thinkingOff": "#a48170",
    "thinkingMinimal": "#a27157",
    "thinkingLow": "#9b6246",
    "thinkingMedium": "#935434",
    "thinkingHigh": "#8b4623",
    "thinkingXhigh": "#7f3915",
    "bashMode": "accent3"
  },
  "export": {
    "pageBg": "#f6f6f6",
    "cardBg": "#f1f1f1",
    "infoBg": "#eae9e9"
  }
}
