{
  "$schema": "../theme-schema.json",
  "name": "ocaso",
  "vars": {
    "amber": "#d4a84b",
    "amberBright": "#e0c070",
    "red": "#e06c75",
    "redBright": "#f09098",
    "green": "#98c379",
    "greenBright": "#b4d89a",
    "purple": "#a078c8",
    "purpleBright": "#c4a8e0",
    "gray4": "#666666",
    "gray5": "#808080",
    "gray6": "#a0a0a0",
    "gray7": "#b8b8b8",
    "ink1": "#141414",
    "ink2": "#1a1a1a",
    "ink3": "#1f1f1f",
    "paToolPendingBg": "#3f3a31",
    "paToolSuccessBg": "#33412d",
    "paToolErrorBg": "#522f32",
    "paUserMessageBg": "#262420",
    "paCustomMessageBg": "#23211e",
    "paToolPanelBg": "#312e27",
    "paSelectedBg": "#403c32",
    "paDiffAddedBg": "#3f4c35",
    "paDiffRemovedBg": "#66373b",
    "paDiffText": "#cccccc",
    "paBashMode": "#e0c070",
    "paPhosphorTrace": "#8c7f63",
    "paPhosphorTrace2": "#726549"
  },
  "colors": {
    "accent": "amber",
    "border": "gray4",
    "borderAccent": "amber",
    "borderMuted": "ink3",
    "success": "green",
    "error": "red",
    "warning": "amberBright",
    "muted": "paPhosphorTrace",
    "dim": "paPhosphorTrace2",
    "text": "",
    "thinkingText": "gray5",
    "selectedBg": "paSelectedBg",
    "userMessageBg": "paUserMessageBg",
    "userMessageText": "",
    "customMessageBg": "paCustomMessageBg",
    "customMessageText": "",
    "customMessageLabel": "amber",
    "toolPendingBg": "paToolPendingBg",
    "toolSuccessBg": "paToolSuccessBg",
    "toolErrorBg": "paToolErrorBg",
    "toolDiffAddedBg": "paDiffAddedBg",
    "toolDiffRemovedBg": "paDiffRemovedBg",
    "toolPanelBg": "paToolPanelBg",
    "toolTitle": "amber",
    "toolOutput": "gray6",
    "mdHeading": "amberBright",
    "mdLink": "gray7",
    "mdLinkUrl": "gray5",
    "mdCode": "amber",
    "mdCodeBlock": "",
    "mdCodeBlockBorder": "paPhosphorTrace2",
    "mdQuote": "gray6",
    "mdQuoteBorder": "paPhosphorTrace2",
    "mdHr": "paPhosphorTrace2",
    "mdListBullet": "amber",
    "toolDiffAdded": "green",
    "toolDiffRemoved": "red",
    "toolDiffText": "paDiffText",
    "toolDiffContext": "paPhosphorTrace",
    "syntaxComment": "paPhosphorTrace2",
    "syntaxKeyword": "amber",
    "syntaxFunction": "gray7",
    "syntaxVariable": "",
    "syntaxString": "green",
    "syntaxNumber": "purpleBright",
    "syntaxType": "amberBright",
    "syntaxOperator": "gray6",
    "syntaxPunctuation": "gray5",
    "thinkingOff": "#50452e",
    "thinkingMinimal": "#725f37",
    "thinkingLow": "#977a3c",
    "thinkingMedium": "#bf963e",
    "thinkingHigh": "#d3aa54",
    "thinkingXhigh": "#e3be6f",
    "bashMode": "paBashMode"
  },
  "export": {
    "pageBg": "#000000",
    "cardBg": "#141414",
    "infoBg": "#1f1f1f"
  }
}
