{
  "$schema": "../theme-schema.json",
  "name": "reckoner-dusk",
  "vars": {
    "bg0": "#1c1b29",
    "bg1": "#13141f",
    "bg2": "#2c2b38",
    "bg3": "#3a3947",
    "line": "#494954",
    "muted0": "#66698d",
    "muted1": "#8b90b3",
    "text0": "#d8d9e6",
    "text1": "#bababe",
    "accent": "#a489d8",
    "accent2": "#c099ff",
    "accent3": "#8e7cc3",
    "cyan": "#67d4ff",
    "blue": "#8ab4ff",
    "green": "#c5e478",
    "gold": "#e7c76b",
    "pink": "#f49ab5",
    "paToolPendingBg": "#2a2939",
    "paToolSuccessBg": "#223223",
    "paToolErrorBg": "#362727",
    "paUserMessageBg": "#2c2a3b",
    "paCustomMessageBg": "#292838",
    "paToolPanelBg": "#373447",
    "paSelectedBg": "#454155",
    "paDiffAddedBg": "#284130",
    "paDiffRemovedBg": "#463038",
    "paDiffText": "#cccccc",
    "paBashMode": "#e7c76b",
    "paPhosphorTrace": "#706985",
    "paPhosphorTrace2": "#4c4563"
  },
  "colors": {
    "accent": "accent",
    "border": "bg2",
    "borderAccent": "accent3",
    "borderMuted": "bg3",
    "success": "cyan",
    "error": "pink",
    "warning": "gold",
    "muted": "muted1",
    "dim": "paPhosphorTrace",
    "text": "text0",
    "thinkingText": "muted1",
    "selectedBg": "paSelectedBg",
    "userMessageBg": "paUserMessageBg",
    "userMessageText": "text0",
    "customMessageBg": "paCustomMessageBg",
    "customMessageText": "text0",
    "customMessageLabel": "accent",
    "toolPendingBg": "paToolPendingBg",
    "toolSuccessBg": "paToolSuccessBg",
    "toolErrorBg": "paToolErrorBg",
    "toolDiffAddedBg": "paDiffAddedBg",
    "toolDiffRemovedBg": "paDiffRemovedBg",
    "toolPanelBg": "paToolPanelBg",
    "toolTitle": "accent2",
    "toolOutput": "text1",
    "mdHeading": "accent2",
    "mdLink": "cyan",
    "mdLinkUrl": "muted1",
    "mdCode": "cyan",
    "mdCodeBlock": "text1",
    "mdCodeBlockBorder": "bg3",
    "mdQuote": "muted1",
    "mdQuoteBorder": "bg3",
    "mdHr": "bg3",
    "mdListBullet": "accent",
    "toolDiffAdded": "green",
    "toolDiffRemoved": "pink",
    "toolDiffText": "paDiffText",
    "toolDiffContext": "muted1",
    "syntaxComment": "muted0",
    "syntaxKeyword": "accent2",
    "syntaxFunction": "blue",
    "syntaxVariable": "text0",
    "syntaxString": "green",
    "syntaxNumber": "gold",
    "syntaxType": "cyan",
    "syntaxOperator": "accent",
    "syntaxPunctuation": "muted1",
    "thinkingOff": "paPhosphorTrace2",
    "thinkingMinimal": "#555371",
    "thinkingLow": "#615992",
    "thinkingMedium": "#7262b0",
    "thinkingHigh": "#8a74c6",
    "thinkingXhigh": "#a489d8",
    "bashMode": "paBashMode"
  },
  "export": {
    "pageBg": "#1c1b29",
    "cardBg": "#13141f",
    "infoBg": "#2c2b38"
  }
}
