{
  "$schema": "../theme-schema.json",
  "name": "reckoner-wopr-sol",
  "vars": {
    "bg0": "#eef0f4",
    "bg1": "#f4f6f8",
    "bg2": "#e5e8ee",
    "bg3": "#dadfe6",
    "line": "#bdc7d6",
    "muted0": "#4e75a7",
    "muted1": "#366aa5",
    "text0": "#084c91",
    "text1": "#206bb6",
    "cyan": "#096bae",
    "cyanPeak": "#096bb3",
    "phosGreen": "#1c7744",
    "gold": "#836407",
    "alarm": "#ae4758",
    "paToolPendingBg": "#e9ecf1",
    "paToolSuccessBg": "#e6efeb",
    "paToolErrorBg": "#e9e2e2",
    "paUserMessageBg": "#e9ecf1",
    "paCustomMessageBg": "#e9edf1",
    "paToolPanelBg": "#e9edf1",
    "paSelectedBg": "#d7dde5",
    "paDiffAddedBg": "#e0ebe7",
    "paDiffRemovedBg": "#eae1e5",
    "paDiffText": "#5b4848",
    "paDim": "#6c88b2",
    "paBashMode": "#f1efe9"
  },
  "colors": {
    "accent": "cyan",
    "border": "bg2",
    "borderAccent": "line",
    "borderMuted": "bg3",
    "success": "phosGreen",
    "error": "alarm",
    "warning": "gold",
    "muted": "muted1",
    "dim": "paDim",
    "text": "text0",
    "thinkingText": "muted1",
    "selectedBg": "paSelectedBg",
    "userMessageBg": "paUserMessageBg",
    "userMessageText": "text0",
    "customMessageBg": "paCustomMessageBg",
    "customMessageText": "text0",
    "customMessageLabel": "cyan",
    "toolPendingBg": "paToolPendingBg",
    "toolSuccessBg": "paToolSuccessBg",
    "toolErrorBg": "paToolErrorBg",
    "toolDiffAddedBg": "#337560",
    "toolDiffRemovedBg": "#895d6f",
    "toolPanelBg": "paToolPanelBg",
    "toolTitle": "cyan",
    "toolOutput": "text1",
    "mdHeading": "cyanPeak",
    "mdLink": "cyan",
    "mdLinkUrl": "muted1",
    "mdCode": "cyanPeak",
    "mdCodeBlock": "text1",
    "mdCodeBlockBorder": "#3468b7",
    "mdQuote": "muted1",
    "mdQuoteBorder": "#3468b7",
    "mdHr": "#3468b7",
    "mdListBullet": "cyan",
    "toolDiffAdded": "phosGreen",
    "toolDiffRemoved": "alarm",
    "toolDiffText": "paDiffText",
    "toolDiffContext": "muted1",
    "syntaxComment": "muted0",
    "syntaxKeyword": "cyan",
    "syntaxFunction": "cyanPeak",
    "syntaxVariable": "text0",
    "syntaxString": "phosGreen",
    "syntaxNumber": "gold",
    "syntaxType": "#096eae",
    "syntaxOperator": "muted1",
    "syntaxPunctuation": "muted1",
    "thinkingOff": "#708ea4",
    "thinkingMinimal": "#5784a2",
    "thinkingLow": "#46789b",
    "thinkingMedium": "#346c93",
    "thinkingHigh": "#23608b",
    "thinkingXhigh": "#15547f",
    "bashMode": "paBashMode"
  },
  "export": {
    "pageBg": "#eef0f4",
    "cardBg": "#f4f6f8",
    "infoBg": "#e5e8ee"
  }
}
