{
  "$schema": "../theme-schema.json",
  "name": "reckoner-factory",
  "vars": {
    "bg0": "#020202",
    "bg1": "#101010",
    "bg2": "#1f1d1c",
    "bg3": "#2e2c2b",
    "line": "#3d3a39",
    "muted0": "#6c685d",
    "muted1": "#8a8380",
    "text0": "#eeeeee",
    "text1": "#d6d3d2",
    "accent": "#ef6f2e",
    "accent2": "#ee6018",
    "accent3": "#d95814",
    "success0": "#6fab78",
    "warning0": "#d8a657",
    "error0": "#e54048",
    "info0": "#7aa2f7",
    "paToolPendingBg": "#2a1c15",
    "paToolSuccessBg": "#212a22",
    "paToolErrorBg": "#381a1c",
    "paUserMessageBg": "#3a2317",
    "paCustomMessageBg": "#313131",
    "paToolPanelBg": "#232323",
    "paSelectedBg": "#4b2a19",
    "paDiffAddedBg": "#2c3d2f",
    "paDiffRemovedBg": "#512022",
    "paDiffText": "#cccccc",
    "paDim": "#767370",
    "paSyntaxComment": "#6b6865"
  },
  "colors": {
    "accent": "accent",
    "border": "bg3",
    "borderAccent": "accent3",
    "borderMuted": "line",
    "success": "success0",
    "error": "error0",
    "warning": "warning0",
    "muted": "muted1",
    "dim": "paDim",
    "text": "text0",
    "thinkingText": "muted1",
    "selectedBg": "paSelectedBg",
    "userMessageBg": "paUserMessageBg",
    "userMessageText": "text0",
    "customMessageBg": "paCustomMessageBg",
    "customMessageText": "text0",
    "customMessageLabel": "accent",
    "toolPendingBg": "paToolPendingBg",
    "toolSuccessBg": "paToolSuccessBg",
    "toolErrorBg": "paToolErrorBg",
    "toolDiffAddedBg": "paDiffAddedBg",
    "toolDiffRemovedBg": "paDiffRemovedBg",
    "toolPanelBg": "paToolPanelBg",
    "toolTitle": "accent",
    "toolOutput": "text1",
    "mdHeading": "accent",
    "mdLink": "accent",
    "mdLinkUrl": "muted1",
    "mdCode": "accent2",
    "mdCodeBlock": "text1",
    "mdCodeBlockBorder": "line",
    "mdQuote": "muted1",
    "mdQuoteBorder": "line",
    "mdHr": "line",
    "mdListBullet": "accent",
    "toolDiffAdded": "success0",
    "toolDiffRemoved": "error0",
    "toolDiffText": "paDiffText",
    "toolDiffContext": "muted1",
    "syntaxComment": "paSyntaxComment",
    "syntaxKeyword": "accent3",
    "syntaxFunction": "accent",
    "syntaxVariable": "text1",
    "syntaxString": "success0",
    "syntaxNumber": "warning0",
    "syntaxType": "info0",
    "syntaxOperator": "accent2",
    "syntaxPunctuation": "muted1",
    "thinkingOff": "#5c5855",
    "thinkingMinimal": "#77604f",
    "thinkingLow": "#966546",
    "thinkingMedium": "#b96939",
    "thinkingHigh": "#d96b2e",
    "thinkingXhigh": "#ef6f2e",
    "bashMode": "accent3"
  },
  "export": {
    "pageBg": "#020202",
    "cardBg": "#101010",
    "infoBg": "#1f1d1c"
  }
}
