{
  "$schema": "../theme-schema.json",
  "name": "voyager",
  "vars": {
    "bg": "#000000",
    "bg1": "#0f0e0d",
    "bg2": "#1a1715",
    "surface": "#141210",
    "overlay": "#2a2623",
    "text": "#f2efec",
    "subtle": "#b1a8a2",
    "dimText": "#817771",
    "cyan": "#22b8ab",
    "mint": "#2ccfc0",
    "green": "#7dd4cc",
    "teal": "#1a9e91",
    "jade": "#a8ddd9",
    "aqua": "#c5ebe8",
    "emerald": "#0f7a6e",
    "lime": "#ddf4f2",
    "paDimKeys": "#8f857f",
    "paToolPendingBg": "#1c2121",
    "paToolSuccessBg": "#132016",
    "paToolErrorBg": "#251918",
    "paUserMessageBg": "#0a100f",
    "paCustomMessageBg": "#080c0c",
    "paToolPanelBg": "#111a1a",
    "paSelectedBg": "#1d2d2b",
    "paDiffAddedBg": "#192e1e",
    "paDiffRemovedBg": "#2d1b1a",
    "paDiffText": "#f2efec"
  },
  "colors": {
    "accent": "mint",
    "border": "subtle",
    "borderAccent": "mint",
    "borderMuted": "subtle",
    "success": "green",
    "error": "emerald",
    "warning": "lime",
    "muted": "subtle",
    "dim": "paDimKeys",
    "text": "text",
    "thinkingText": "jade",
    "selectedBg": "paSelectedBg",
    "userMessageBg": "paUserMessageBg",
    "userMessageText": "text",
    "customMessageBg": "paCustomMessageBg",
    "customMessageText": "text",
    "customMessageLabel": "mint",
    "toolPendingBg": "paToolPendingBg",
    "toolSuccessBg": "paToolSuccessBg",
    "toolErrorBg": "paToolErrorBg",
    "toolDiffAddedBg": "paDiffAddedBg",
    "toolDiffRemovedBg": "paDiffRemovedBg",
    "toolPanelBg": "paToolPanelBg",
    "toolTitle": "mint",
    "toolOutput": "text",
    "mdHeading": "mint",
    "mdLink": "cyan",
    "mdLinkUrl": "subtle",
    "mdCode": "cyan",
    "mdCodeBlock": "text",
    "mdCodeBlockBorder": "subtle",
    "mdQuote": "subtle",
    "mdQuoteBorder": "teal",
    "mdHr": "subtle",
    "mdListBullet": "mint",
    "toolDiffAdded": "green",
    "toolDiffRemoved": "emerald",
    "toolDiffText": "paDiffText",
    "toolDiffContext": "subtle",
    "syntaxComment": "dimText",
    "syntaxKeyword": "jade",
    "syntaxFunction": "green",
    "syntaxVariable": "text",
    "syntaxString": "lime",
    "syntaxNumber": "aqua",
    "syntaxType": "cyan",
    "syntaxOperator": "emerald",
    "syntaxPunctuation": "subtle",
    "thinkingOff": "#718180",
    "thinkingMinimal": "#64908c",
    "thinkingLow": "#56a099",
    "thinkingMedium": "#48afa6",
    "thinkingHigh": "#3abfb3",
    "thinkingXhigh": "#2ccfc0",
    "bashMode": "lime"
  },
  "export": {
    "pageBg": "#000000",
    "cardBg": "#141210",
    "infoBg": "#1a1715"
  }
}
