{
  "$schema": "../theme-schema.json",
  "name": "amnesiac",
  "vars": {
    "bg": "#000000",
    "bg1": "#0f0e0d",
    "bg2": "#1a1715",
    "surface": "#141210",
    "overlay": "#2a2623",
    "text": "#f2efec",
    "subtle": "#b1a8a2",
    "dimText": "#817771",
    "cyan": "#6b7ef5",
    "mint": "#7b93ff",
    "green": "#9baaf2",
    "teal": "#5c70d8",
    "jade": "#b4bef0",
    "aqua": "#c8d2ff",
    "emerald": "#4d5ec8",
    "lime": "#dce2ff",
    "paDimKeys": "#8f857f",
    "paToolPendingBg": "#191b24",
    "paToolSuccessBg": "#132016",
    "paToolErrorBg": "#251918",
    "paUserMessageBg": "#080a11",
    "paCustomMessageBg": "#07080e",
    "paToolPanelBg": "#0e111d",
    "paSelectedBg": "#191d31",
    "paDiffAddedBg": "#192e1e",
    "paDiffRemovedBg": "#2d1b1a",
    "paDiffText": "#f2efec"
  },
  "colors": {
    "accent": "mint",
    "border": "subtle",
    "borderAccent": "mint",
    "borderMuted": "subtle",
    "success": "green",
    "error": "emerald",
    "warning": "lime",
    "muted": "subtle",
    "dim": "paDimKeys",
    "text": "text",
    "thinkingText": "jade",
    "selectedBg": "paSelectedBg",
    "userMessageBg": "paUserMessageBg",
    "userMessageText": "text",
    "customMessageBg": "paCustomMessageBg",
    "customMessageText": "text",
    "customMessageLabel": "mint",
    "toolPendingBg": "paToolPendingBg",
    "toolSuccessBg": "paToolSuccessBg",
    "toolErrorBg": "paToolErrorBg",
    "toolDiffAddedBg": "paDiffAddedBg",
    "toolDiffRemovedBg": "paDiffRemovedBg",
    "toolPanelBg": "paToolPanelBg",
    "toolTitle": "mint",
    "toolOutput": "text",
    "mdHeading": "mint",
    "mdLink": "cyan",
    "mdLinkUrl": "subtle",
    "mdCode": "cyan",
    "mdCodeBlock": "text",
    "mdCodeBlockBorder": "subtle",
    "mdQuote": "subtle",
    "mdQuoteBorder": "teal",
    "mdHr": "subtle",
    "mdListBullet": "mint",
    "toolDiffAdded": "green",
    "toolDiffRemoved": "emerald",
    "toolDiffText": "paDiffText",
    "toolDiffContext": "subtle",
    "syntaxComment": "dimText",
    "syntaxKeyword": "jade",
    "syntaxFunction": "green",
    "syntaxVariable": "text",
    "syntaxString": "lime",
    "syntaxNumber": "aqua",
    "syntaxType": "cyan",
    "syntaxOperator": "emerald",
    "syntaxPunctuation": "subtle",
    "thinkingOff": "#717481",
    "thinkingMinimal": "#6873a5",
    "thinkingLow": "#6576c3",
    "thinkingMedium": "#677cdc",
    "thinkingHigh": "#6e86f0",
    "thinkingXhigh": "#7a93ff",
    "bashMode": "lime"
  },
  "export": {
    "pageBg": "#000000",
    "cardBg": "#141210",
    "infoBg": "#1a1715"
  }
}
