{
  "$schema": "../theme-schema.json",
  "name": "reckoner-scope",
  "vars": {
    "bg0": "#0a120c",
    "bg1": "#060d08",
    "bg2": "#14231a",
    "bg3": "#1e3325",
    "line": "#2e5038",
    "muted0": "#3f7a52",
    "muted1": "#55a06b",
    "text0": "#6fe392",
    "text1": "#58c47b",
    "greenHot": "#a8ffc2",
    "greenPeak": "#dcffe7",
    "amber": "#e8d25f",
    "alarm": "#ff7a5c",
    "paToolPendingBg": "#222c25",
    "paToolSuccessBg": "#213326",
    "paToolErrorBg": "#3d251f",
    "paUserMessageBg": "#2d3d32",
    "paCustomMessageBg": "#313131",
    "paToolPanelBg": "#232323",
    "paSelectedBg": "#395040",
    "paDiffAddedBg": "#2c4d36",
    "paDiffRemovedBg": "#593128",
    "paDiffText": "#cccccc",
    "paDim": "#506d58",
    "paBashMode": "#e8d25f"
  },
  "colors": {
    "accent": "greenHot",
    "border": "bg2",
    "borderAccent": "line",
    "borderMuted": "bg3",
    "success": "text0",
    "error": "alarm",
    "warning": "amber",
    "muted": "muted1",
    "dim": "paDim",
    "text": "text0",
    "thinkingText": "muted1",
    "selectedBg": "paSelectedBg",
    "userMessageBg": "paUserMessageBg",
    "userMessageText": "text0",
    "customMessageBg": "paCustomMessageBg",
    "customMessageText": "text0",
    "customMessageLabel": "greenHot",
    "toolPendingBg": "paToolPendingBg",
    "toolSuccessBg": "paToolSuccessBg",
    "toolErrorBg": "paToolErrorBg",
    "toolDiffAddedBg": "paDiffAddedBg",
    "toolDiffRemovedBg": "paDiffRemovedBg",
    "toolPanelBg": "paToolPanelBg",
    "toolTitle": "greenHot",
    "toolOutput": "text1",
    "mdHeading": "greenPeak",
    "mdLink": "greenHot",
    "mdLinkUrl": "muted1",
    "mdCode": "greenPeak",
    "mdCodeBlock": "text1",
    "mdCodeBlockBorder": "bg3",
    "mdQuote": "muted1",
    "mdQuoteBorder": "bg3",
    "mdHr": "bg3",
    "mdListBullet": "greenHot",
    "toolDiffAdded": "greenHot",
    "toolDiffRemoved": "alarm",
    "toolDiffText": "paDiffText",
    "toolDiffContext": "muted1",
    "syntaxComment": "muted0",
    "syntaxKeyword": "greenHot",
    "syntaxFunction": "greenPeak",
    "syntaxVariable": "text0",
    "syntaxString": "#8fe9ab",
    "syntaxNumber": "#c4f7d2",
    "syntaxType": "greenHot",
    "syntaxOperator": "muted1",
    "syntaxPunctuation": "muted1",
    "thinkingOff": "#2e5038",
    "thinkingMinimal": "#377248",
    "thinkingLow": "#3c9757",
    "thinkingMedium": "#3ebf64",
    "thinkingHigh": "#54d37a",
    "thinkingXhigh": "#6fe392",
    "bashMode": "paBashMode"
  },
  "export": {
    "pageBg": "#0a120c",
    "cardBg": "#060d08",
    "infoBg": "#14231a"
  }
}
