{
  "$schema": "../theme-schema.json",
  "name": "mediodia",
  "vars": {
    "rosewater": "#dc8a78",
    "pink": "#ea76cb",
    "mauve": "#8839ef",
    "red": "#d20f39",
    "peach": "#fe640b",
    "yellow": "#df8e1d",
    "green": "#40a02b",
    "teal": "#179299",
    "blue": "#1e66f5",
    "lavender": "#7287fd",
    "text": "#4c4f69",
    "subtext": "#5c5f77",
    "overlay1": "#8c8fa1",
    "overlay0": "#9ca0b0",
    "surface1": "#bcc0cc",
    "surface0": "#ccd0da",
    "mantle": "#e6e9ef",
    "crust": "#dce0e8",
    "paToolPendingBg": "#e4e5ec",
    "paToolSuccessBg": "#dceadd",
    "paToolErrorBg": "#ecdfe2",
    "paUserMessageBg": "#e8e7ee",
    "paCustomMessageBg": "#eaeaf0",
    "paToolPanelBg": "#dedde7",
    "paSelectedBg": "#cfcbda",
    "paDiffAddedBg": "#c9e3cb",
    "paDiffRemovedBg": "#e5c8cf",
    "paDiffText": "#4c4f69"
  },
  "colors": {
    "accent": "mauve",
    "border": "surface1",
    "borderAccent": "mauve",
    "borderMuted": "surface0",
    "success": "green",
    "error": "red",
    "warning": "yellow",
    "muted": "overlay1",
    "dim": "overlay0",
    "text": "",
    "thinkingText": "overlay1",
    "selectedBg": "paSelectedBg",
    "userMessageBg": "paUserMessageBg",
    "userMessageText": "",
    "customMessageBg": "paCustomMessageBg",
    "customMessageText": "",
    "customMessageLabel": "mauve",
    "toolPendingBg": "paToolPendingBg",
    "toolSuccessBg": "paToolSuccessBg",
    "toolErrorBg": "paToolErrorBg",
    "toolDiffAddedBg": "paDiffAddedBg",
    "toolDiffRemovedBg": "paDiffRemovedBg",
    "toolPanelBg": "paToolPanelBg",
    "toolTitle": "blue",
    "toolOutput": "subtext",
    "mdHeading": "lavender",
    "mdLink": "blue",
    "mdLinkUrl": "overlay1",
    "mdCode": "peach",
    "mdCodeBlock": "",
    "mdCodeBlockBorder": "surface1",
    "mdQuote": "subtext",
    "mdQuoteBorder": "surface1",
    "mdHr": "surface1",
    "mdListBullet": "mauve",
    "toolDiffAdded": "green",
    "toolDiffRemoved": "red",
    "toolDiffText": "paDiffText",
    "toolDiffContext": "overlay1",
    "syntaxComment": "overlay0",
    "syntaxKeyword": "mauve",
    "syntaxFunction": "blue",
    "syntaxVariable": "",
    "syntaxString": "green",
    "syntaxNumber": "peach",
    "syntaxType": "yellow",
    "syntaxOperator": "teal",
    "syntaxPunctuation": "overlay1",
    "thinkingOff": "#c5b6d8",
    "thinkingMinimal": "#ad92d0",
    "thinkingLow": "#9469cd",
    "thinkingMedium": "#7b3cce",
    "thinkingHigh": "#6521bd",
    "thinkingXhigh": "#4f0da5",
    "bashMode": "peach"
  },
  "export": {
    "pageBg": "#dce0e8",
    "cardBg": "#e6e9ef",
    "infoBg": "#bcc0cc"
  }
}
