{
  "$schema": "../theme-schema.json",
  "name": "aerodynamic-sol",
  "vars": {
    "bg": "#f6f6f6",
    "bg0": "#e9e9ea",
    "bg1": "#f1f1f1",
    "bg2": "#dfe0e2",
    "bg3": "#dfe0e2",
    "surface": "#dfe0e2",
    "overlay": "#dfe0e2",
    "line": "#c7c9cc",
    "muted0": "#607b75",
    "muted1": "#527067",
    "text": "#225346",
    "text0": "#225346",
    "text1": "#427062",
    "subtle": "#527067",
    "dimText": "#556d67",
    "cyan": "#067956",
    "mint": "#067956",
    "green": "#16793a",
    "teal": "#19766d",
    "jade": "#15745d",
    "aqua": "#0a755d",
    "emerald": "#177858",
    "lime": "#21783e",
    "paDim": "#6e8c84",
    "paToolPendingBg": "#ecefee",
    "paToolSuccessBg": "#e6efe8",
    "paToolErrorBg": "#ebe1e0",
    "paUserMessageBg": "#e9f1ef",
    "paCustomMessageBg": "#e9f1ef",
    "paToolPanelBg": "#e9f1ef",
    "paSelectedBg": "#d7e5e1",
    "paDiffAddedBg": "#e0ebe3",
    "paDiffRemovedBg": "#ebe0e0",
    "paDiffText": "#225346"
  },
  "colors": {
    "accent": "mint",
    "border": "bg2",
    "borderAccent": "mint",
    "borderMuted": "bg3",
    "success": "green",
    "error": "emerald",
    "warning": "lime",
    "muted": "subtle",
    "dim": "paDim",
    "text": "text0",
    "thinkingText": "jade",
    "selectedBg": "paSelectedBg",
    "userMessageBg": "paUserMessageBg",
    "userMessageText": "text0",
    "customMessageBg": "paCustomMessageBg",
    "customMessageText": "text0",
    "customMessageLabel": "mint",
    "toolPendingBg": "paToolPendingBg",
    "toolSuccessBg": "paToolSuccessBg",
    "toolErrorBg": "paToolErrorBg",
    "toolDiffAddedBg": "#3f744b",
    "toolDiffRemovedBg": "#955956",
    "toolPanelBg": "paToolPanelBg",
    "toolTitle": "mint",
    "toolOutput": "text",
    "mdHeading": "mint",
    "mdLink": "cyan",
    "mdLinkUrl": "subtle",
    "mdCode": "cyan",
    "mdCodeBlock": "text1",
    "mdCodeBlockBorder": "#60697b",
    "mdQuote": "subtle",
    "mdQuoteBorder": "#60697b",
    "mdHr": "#60697b",
    "mdListBullet": "mint",
    "toolDiffAdded": "green",
    "toolDiffRemoved": "emerald",
    "toolDiffText": "paDiffText",
    "toolDiffContext": "subtle",
    "syntaxComment": "dimText",
    "syntaxKeyword": "jade",
    "syntaxFunction": "green",
    "syntaxVariable": "text0",
    "syntaxString": "lime",
    "syntaxNumber": "aqua",
    "syntaxType": "cyan",
    "syntaxOperator": "emerald",
    "syntaxPunctuation": "subtle",
    "thinkingOff": "#70a494",
    "thinkingMinimal": "#57a28c",
    "thinkingLow": "#469b81",
    "thinkingMedium": "#349376",
    "thinkingHigh": "#238b6b",
    "thinkingXhigh": "#157f5f",
    "bashMode": "lime"
  },
  "export": {
    "pageBg": "#e9e9ea",
    "cardBg": "#f1f1f1",
    "infoBg": "#dfe0e2"
  }
}
