{
  "$schema": "../theme-schema.json",
  "name": "atardecer",
  "vars": {
    "fg": "#d4be98",
    "red": "#ea6962",
    "orange": "#e78a4e",
    "yellow": "#d8a657",
    "green": "#a9b665",
    "aqua": "#89b482",
    "blue": "#7daea3",
    "purple": "#d3869b",
    "grey0": "#7c6f64",
    "grey1": "#928374",
    "grey2": "#a89984",
    "bg1": "#282828",
    "bg2": "#32302f",
    "bg3": "#3c3836",
    "bgDim": "#1d2021",
    "paToolPendingBg": "#454745",
    "paToolSuccessBg": "#404c34",
    "paToolErrorBg": "#633937",
    "paUserMessageBg": "#2f302c",
    "paCustomMessageBg": "#2c2d2a",
    "paToolPanelBg": "#3a3a34",
    "paSelectedBg": "#4b473f",
    "paDiffAddedBg": "#4d593a",
    "paDiffRemovedBg": "#79413e",
    "paDiffText": "#dbc9a9"
  },
  "colors": {
    "accent": "yellow",
    "border": "grey0",
    "borderAccent": "yellow",
    "borderMuted": "bg3",
    "success": "green",
    "error": "red",
    "warning": "orange",
    "muted": "grey1",
    "dim": "grey0",
    "text": "",
    "thinkingText": "grey1",
    "selectedBg": "paSelectedBg",
    "userMessageBg": "paUserMessageBg",
    "userMessageText": "",
    "customMessageBg": "paCustomMessageBg",
    "customMessageText": "",
    "customMessageLabel": "yellow",
    "toolPendingBg": "paToolPendingBg",
    "toolSuccessBg": "paToolSuccessBg",
    "toolErrorBg": "paToolErrorBg",
    "toolDiffAddedBg": "paDiffAddedBg",
    "toolDiffRemovedBg": "paDiffRemovedBg",
    "toolPanelBg": "paToolPanelBg",
    "toolTitle": "aqua",
    "toolOutput": "grey2",
    "mdHeading": "orange",
    "mdLink": "blue",
    "mdLinkUrl": "grey1",
    "mdCode": "yellow",
    "mdCodeBlock": "",
    "mdCodeBlockBorder": "bg3",
    "mdQuote": "grey2",
    "mdQuoteBorder": "bg3",
    "mdHr": "bg3",
    "mdListBullet": "yellow",
    "toolDiffAdded": "green",
    "toolDiffRemoved": "red",
    "toolDiffText": "paDiffText",
    "toolDiffContext": "grey1",
    "syntaxComment": "grey1",
    "syntaxKeyword": "red",
    "syntaxFunction": "green",
    "syntaxVariable": "",
    "syntaxString": "aqua",
    "syntaxNumber": "purple",
    "syntaxType": "yellow",
    "syntaxOperator": "orange",
    "syntaxPunctuation": "grey2",
    "thinkingOff": "#50432e",
    "thinkingMinimal": "#725b37",
    "thinkingLow": "#97743c",
    "thinkingMedium": "#bf8d3e",
    "thinkingHigh": "#d3a254",
    "thinkingXhigh": "#e3b66f",
    "bashMode": "orange"
  },
  "export": {
    "pageBg": "#1d2021",
    "cardBg": "#282828",
    "infoBg": "#3c3836"
  }
}
