{
  "$schema": "../theme-schema.json",
  "name": "reckoner-dusk-sol",
  "vars": {
    "bg0": "#f0f0f2",
    "bg1": "#f5f5f7",
    "bg2": "#e8e8ea",
    "bg3": "#dfdfe2",
    "line": "#c8c8cb",
    "muted0": "#6e7196",
    "muted1": "#616794",
    "text0": "#46496d",
    "text1": "#676783",
    "accent": "#774fc5",
    "accent2": "#7e37f0",
    "accent3": "#715bb4",
    "cyan": "#08719b",
    "blue": "#0c5ded",
    "green": "#556e16",
    "gold": "#7f6415",
    "pink": "#ca164c",
    "paToolPendingBg": "#ebeaf0",
    "paToolSuccessBg": "#e7eee7",
    "paToolErrorBg": "#eae1e1",
    "paUserMessageBg": "#ebeaf0",
    "paCustomMessageBg": "#ebeaf0",
    "paToolPanelBg": "#ebeaf0",
    "paSelectedBg": "#dbd9e2",
    "paDiffAddedBg": "#e0ebe3",
    "paDiffRemovedBg": "#eae1e4",
    "paDiffText": "#5b4848",
    "paDim": "#88819c",
    "paBashMode": "#f1efe9",
    "paPhosphorTrace": "#ecebef",
    "paPhosphorTrace2": "#ebeaf0"
  },
  "colors": {
    "accent": "accent",
    "border": "bg2",
    "borderAccent": "accent3",
    "borderMuted": "bg3",
    "success": "cyan",
    "error": "pink",
    "warning": "gold",
    "muted": "muted1",
    "dim": "paDim",
    "text": "text0",
    "thinkingText": "muted1",
    "selectedBg": "paSelectedBg",
    "userMessageBg": "paUserMessageBg",
    "userMessageText": "text0",
    "customMessageBg": "paCustomMessageBg",
    "customMessageText": "text0",
    "customMessageLabel": "accent",
    "toolPendingBg": "paToolPendingBg",
    "toolSuccessBg": "paToolSuccessBg",
    "toolErrorBg": "paToolErrorBg",
    "toolDiffAddedBg": "#467254",
    "toolDiffRemovedBg": "#885d6d",
    "toolPanelBg": "paToolPanelBg",
    "toolTitle": "accent2",
    "toolOutput": "text1",
    "mdHeading": "accent2",
    "mdLink": "cyan",
    "mdLinkUrl": "muted1",
    "mdCode": "cyan",
    "mdCodeBlock": "text1",
    "mdCodeBlockBorder": "#696783",
    "mdQuote": "muted1",
    "mdQuoteBorder": "#696783",
    "mdHr": "#696783",
    "mdListBullet": "accent",
    "toolDiffAdded": "green",
    "toolDiffRemoved": "pink",
    "toolDiffText": "paDiffText",
    "toolDiffContext": "muted1",
    "syntaxComment": "muted0",
    "syntaxKeyword": "accent2",
    "syntaxFunction": "blue",
    "syntaxVariable": "text0",
    "syntaxString": "green",
    "syntaxNumber": "gold",
    "syntaxType": "cyan",
    "syntaxOperator": "accent",
    "syntaxPunctuation": "muted1",
    "thinkingOff": "#8270a4",
    "thinkingMinimal": "#7157a2",
    "thinkingLow": "#63469b",
    "thinkingMedium": "#543493",
    "thinkingHigh": "#46238b",
    "thinkingXhigh": "#39157f",
    "bashMode": "paBashMode"
  },
  "export": {
    "pageBg": "#f0f0f2",
    "cardBg": "#f5f5f7",
    "infoBg": "#e8e8ea"
  }
}
