{
  "$schema": "../theme-schema.json",
  "name": "veridis",
  "vars": {
    "bg": "#000000",
    "bg1": "#0f0e0d",
    "bg2": "#1a1715",
    "surface": "#141210",
    "overlay": "#2a2623",
    "text": "#f2efec",
    "subtle": "#b1a8a2",
    "dimText": "#817771",
    "cyan": "#00e0a0",
    "mint": "#00ffb2",
    "green": "#4de8c0",
    "teal": "#00c490",
    "jade": "#7adec8",
    "aqua": "#a8f0de",
    "emerald": "#00a878",
    "lime": "#d0f7ec",
    "paDimKeys": "#8f857f",
    "paToolPendingBg": "#1c2120",
    "paToolSuccessBg": "#132016",
    "paToolErrorBg": "#251918",
    "paUserMessageBg": "#08110f",
    "paCustomMessageBg": "#070e0c",
    "paToolPanelBg": "#0e1d19",
    "paSelectedBg": "#19312a",
    "paDiffAddedBg": "#192e1e",
    "paDiffRemovedBg": "#2d1b1a",
    "paDiffText": "#f2efec"
  },
  "colors": {
    "accent": "mint",
    "border": "subtle",
    "borderAccent": "mint",
    "borderMuted": "subtle",
    "success": "green",
    "error": "emerald",
    "warning": "lime",
    "muted": "subtle",
    "dim": "paDimKeys",
    "text": "text",
    "thinkingText": "jade",
    "selectedBg": "paSelectedBg",
    "userMessageBg": "paUserMessageBg",
    "userMessageText": "text",
    "customMessageBg": "paCustomMessageBg",
    "customMessageText": "text",
    "customMessageLabel": "mint",
    "toolPendingBg": "paToolPendingBg",
    "toolSuccessBg": "paToolSuccessBg",
    "toolErrorBg": "paToolErrorBg",
    "toolDiffAddedBg": "paDiffAddedBg",
    "toolDiffRemovedBg": "paDiffRemovedBg",
    "toolPanelBg": "paToolPanelBg",
    "toolTitle": "mint",
    "toolOutput": "text",
    "mdHeading": "mint",
    "mdLink": "cyan",
    "mdLinkUrl": "subtle",
    "mdCode": "cyan",
    "mdCodeBlock": "text",
    "mdCodeBlockBorder": "subtle",
    "mdQuote": "subtle",
    "mdQuoteBorder": "teal",
    "mdHr": "subtle",
    "mdListBullet": "mint",
    "toolDiffAdded": "green",
    "toolDiffRemoved": "emerald",
    "toolDiffText": "paDiffText",
    "toolDiffContext": "subtle",
    "syntaxComment": "dimText",
    "syntaxKeyword": "jade",
    "syntaxFunction": "green",
    "syntaxVariable": "text",
    "syntaxString": "lime",
    "syntaxNumber": "aqua",
    "syntaxType": "cyan",
    "syntaxOperator": "emerald",
    "syntaxPunctuation": "subtle",
    "thinkingOff": "#71817c",
    "thinkingMinimal": "#5b9987",
    "thinkingLow": "#45b291",
    "thinkingMedium": "#2fcb9c",
    "thinkingHigh": "#18e5a7",
    "thinkingXhigh": "#00ffb2",
    "bashMode": "lime"
  },
  "export": {
    "pageBg": "#000000",
    "cardBg": "#141210",
    "infoBg": "#1a1715"
  }
}
