{
  "$schema": "../theme-schema.json",
  "name": "amanecer",
  "vars": {
    "bg0": "#191724",
    "bg1": "#100e17",
    "bg2": "#1f1d2e",
    "bg3": "#26233a",
    "line": "#403d52",
    "muted0": "#6e6a86",
    "muted1": "#908caa",
    "text0": "#e0def4",
    "text1": "#bcb9d3",
    "love": "#eb6f92",
    "gold": "#f6c177",
    "rose": "#ebbcba",
    "pine": "#3e8fb0",
    "foam": "#9ccfd8",
    "iris": "#c4a7e7",
    "paToolPendingBg": "#282531",
    "paToolSuccessBg": "#202d21",
    "paToolErrorBg": "#36202a",
    "paUserMessageBg": "#2a2733",
    "paCustomMessageBg": "#272430",
    "paToolPanelBg": "#35313c",
    "paSelectedBg": "#443e48",
    "paDiffAddedBg": "#2c392d",
    "paDiffRemovedBg": "#452939",
    "paDiffText": "#e0def4",
    "paDim": "#65617a"
  },
  "colors": {
    "accent": "rose",
    "border": "bg2",
    "borderAccent": "rose",
    "borderMuted": "bg3",
    "success": "foam",
    "error": "love",
    "warning": "gold",
    "muted": "muted1",
    "dim": "paDim",
    "text": "text0",
    "thinkingText": "muted1",
    "selectedBg": "paSelectedBg",
    "userMessageBg": "paUserMessageBg",
    "userMessageText": "text0",
    "customMessageBg": "paCustomMessageBg",
    "customMessageText": "text0",
    "customMessageLabel": "iris",
    "toolPendingBg": "paToolPendingBg",
    "toolSuccessBg": "paToolSuccessBg",
    "toolErrorBg": "paToolErrorBg",
    "toolDiffAddedBg": "paDiffAddedBg",
    "toolDiffRemovedBg": "paDiffRemovedBg",
    "toolPanelBg": "paToolPanelBg",
    "toolTitle": "foam",
    "toolOutput": "muted1",
    "mdHeading": "iris",
    "mdLink": "foam",
    "mdLinkUrl": "muted0",
    "mdCode": "gold",
    "mdCodeBlock": "text1",
    "mdCodeBlockBorder": "line",
    "mdQuote": "muted1",
    "mdQuoteBorder": "line",
    "mdHr": "line",
    "mdListBullet": "rose",
    "toolDiffAdded": "foam",
    "toolDiffRemoved": "love",
    "toolDiffText": "paDiffText",
    "toolDiffContext": "muted1",
    "syntaxComment": "muted0",
    "syntaxKeyword": "pine",
    "syntaxFunction": "rose",
    "syntaxVariable": "text0",
    "syntaxString": "gold",
    "syntaxNumber": "iris",
    "syntaxType": "foam",
    "syntaxOperator": "muted1",
    "syntaxPunctuation": "muted1",
    "thinkingOff": "#502e38",
    "thinkingMinimal": "#723748",
    "thinkingLow": "#973c56",
    "thinkingMedium": "#bf3e62",
    "thinkingHigh": "#d35478",
    "thinkingXhigh": "#e36f90",
    "bashMode": "gold"
  },
  "export": {
    "pageBg": "#191724",
    "cardBg": "#100e17",
    "infoBg": "#1f1d2e"
  }
}
