{
  "$schema": "../theme-schema.json",
  "name": "reckoner-darkspace-sol",
  "vars": {
    "bg0": "#edf4f4",
    "bg1": "#f4f8f8",
    "bg2": "#e4edef",
    "bg3": "#d9e6e8",
    "line": "#bcd4d7",
    "muted0": "#198078",
    "muted1": "#197670",
    "text0": "#0b5651",
    "text1": "#1c736d",
    "tealHot": "#067469",
    "tealPeak": "#067468",
    "mint": "#067944",
    "gold": "#786811",
    "alarm": "#b5405c",
    "paToolPendingBg": "#ebefef",
    "paToolSuccessBg": "#e6efeb",
    "paToolErrorBg": "#ebe0e3",
    "paUserMessageBg": "#e9f0f1",
    "paCustomMessageBg": "#e9f1f1",
    "paToolPanelBg": "#e9f1f1",
    "paSelectedBg": "#d7e4e4",
    "paDiffAddedBg": "#e0ebe7",
    "paDiffRemovedBg": "#ebe0e2",
    "paDiffText": "#5b4848",
    "paDim": "#4a9096",
    "paSyntaxComment": "#e9f1f0",
    "paBashMode": "#f1f0e9",
    "paSyntaxNumber": "#e9f1f0"
  },
  "colors": {
    "accent": "tealHot",
    "border": "bg2",
    "borderAccent": "line",
    "borderMuted": "bg3",
    "success": "mint",
    "error": "alarm",
    "warning": "gold",
    "muted": "muted1",
    "dim": "paDim",
    "text": "text0",
    "thinkingText": "muted1",
    "selectedBg": "paSelectedBg",
    "userMessageBg": "paUserMessageBg",
    "userMessageText": "text0",
    "customMessageBg": "paCustomMessageBg",
    "customMessageText": "text0",
    "customMessageLabel": "tealHot",
    "toolPendingBg": "paToolPendingBg",
    "toolSuccessBg": "paToolSuccessBg",
    "toolErrorBg": "paToolErrorBg",
    "toolDiffAddedBg": "#257458",
    "toolDiffRemovedBg": "#a44c5f",
    "toolPanelBg": "paToolPanelBg",
    "toolTitle": "tealHot",
    "toolOutput": "text1",
    "mdHeading": "tealPeak",
    "mdLink": "tealHot",
    "mdLinkUrl": "muted1",
    "mdCode": "tealPeak",
    "mdCodeBlock": "text1",
    "mdCodeBlockBorder": "#177482",
    "mdHr": "#177482",
    "mdQuote": "muted1",
    "mdQuoteBorder": "#177482",
    "mdListBullet": "tealHot",
    "toolDiffAdded": "mint",
    "toolDiffRemoved": "alarm",
    "toolDiffText": "paDiffText",
    "toolDiffContext": "muted1",
    "syntaxComment": "#27817a",
    "syntaxKeyword": "tealHot",
    "syntaxFunction": "tealPeak",
    "syntaxVariable": "text0",
    "syntaxString": "mint",
    "syntaxNumber": "#0b745f",
    "syntaxType": "#06746a",
    "syntaxOperator": "muted1",
    "syntaxPunctuation": "muted1",
    "thinkingOff": "#70a49e",
    "thinkingMinimal": "#57a29b",
    "thinkingLow": "#469b92",
    "thinkingMedium": "#34938a",
    "thinkingHigh": "#238b80",
    "thinkingXhigh": "#157f75",
    "bashMode": "paBashMode"
  },
  "export": {
    "pageBg": "#edf4f4",
    "cardBg": "#f4f8f8",
    "infoBg": "#e4edef"
  }
}
